{
  "id": "lucid-flex-50k",
  "name": "LucidFlex 50k Evaluation",
  "type": "futures",
  "platform": ["NinjaTrader", "Tradovate", "Rithmic"],
  "account_size_usd": 50000,
  "phase": "evaluation",
  "profit_target_usd": 3000,
  "drawdown": {
    "mode": "trailing_eod",
    "amount_usd": 2000,
    "lock_at_usd": null,
    "notes": "Max Loss Limit $2000 que trail EOD (NO intraday). Una vez cerrado el día, MLL se actualiza al close. Si EOD balance sube, MLL trails. NO se bloquea al alcanzar balance inicial — sigue trailing."
  },
  "max_daily_loss_usd": null,
  "consistency_rule_pct": 50,
  "min_trading_days": 2,
  "max_contracts": 4,
  "max_lot_size": null,
  "allow_overnight": false,
  "allow_news_trading": true,
  "scaling_plan_required": false,
  "notes": "LucidFlex 50k: cap 4 minis O 40 micros (mixto permitido, ≤ 4 minis equivalente). Consistency 50% durante eval (max día ≤ $1500 si target es $3000). Sin daily loss. Sin time limit. Posiciones flat al cierre diario. Una vez funded, consistency = 0%. Existen variantes Pro/Direct/Maxx con reglas distintas (Pro tiene consistency 40%).",
  "last_verified": "2026-05-16",
  "source_url": "https://lucidtrading.com/"
}
