{
  "id": "takeprofit-50k",
  "name": "TakeProfit Trader 50k Evaluation",
  "type": "futures",
  "platform": ["NinjaTrader", "Tradovate", "Rithmic"],
  "account_size_usd": 50000,
  "phase": "evaluation",
  "profit_target_usd": 3000,
  "drawdown": {
    "mode": "trailing_eod",
    "amount_usd": 2000,
    "lock_at_usd": 52000,
    "notes": "Trailing EOD hasta +2000 sobre inicial."
  },
  "max_daily_loss_usd": null,
  "consistency_rule_pct": null,
  "min_trading_days": 5,
  "max_contracts": 5,
  "max_lot_size": null,
  "allow_overnight": false,
  "allow_news_trading": true,
  "scaling_plan_required": false,
  "notes": "Mínimo 5 días operativos para pasar evaluación.",
  "last_verified": "2026-05-16",
  "source_url": "https://takeprofittrader.com/"
}
