{
  "id": "topstep-50k",
  "name": "TopStep 50k Combine",
  "type": "futures",
  "platform": ["TopstepX", "NinjaTrader", "Tradovate", "Rithmic"],
  "account_size_usd": 50000,
  "phase": "evaluation",
  "profit_target_usd": 3000,
  "drawdown": {
    "mode": "trailing_eod",
    "amount_usd": 2000,
    "lock_at_usd": 52000,
    "notes": "Trailing EOD (basado en balance al cierre, no en equity intradía). Se bloquea al alcanzar balance inicial + 2000."
  },
  "max_daily_loss_usd": 1000,
  "consistency_rule_pct": null,
  "min_trading_days": 2,
  "max_contracts": 5,
  "max_lot_size": null,
  "allow_overnight": false,
  "allow_news_trading": true,
  "scaling_plan_required": false,
  "notes": "Daily loss limit estricto $1000. Sin consistency rule en Combine pero sí en Funded Account. Cierre forzado 15:10 CT (16:10 ET).",
  "last_verified": "2026-05-16",
  "source_url": "https://www.topstep.com/"
}
